,reviewerName,helpful,reviewText,overall,summary,sentiment polarity,sentiment comparison
18,Amazon Customer,"[9, 13]","This isn't a terrible tuner, and for how cheap it was, it wasn't a ""ripoff"". However, it definetly does not work as the product or other people claim. When it does work, it tunes decently like any ten dollar tuner. However almost all of the time it's fluttering around to completely different notes or just not reading a single thing. I try clipping it on different parts of the instrument and it's the same. It also did not come with batteries, and replacement ones aren't cheap and are very hard to find. I don't think this is a terrible product due to the low price, but if you want to be taken seriously and take your own music seriously, get a real desktop tuner. A cheapo one is only 5 bucks more and you can find REAL, full sized, affordable batteries for it...",2.0,I don't know why people are raving...,0.1461289164546556,1.2693554177267221
19,"Fender Guy ""Rick""","[9, 12]","I've owned more than one overdrive pedal in my 30 years of playing guitar and the only one I still have on my pedal board is the Boss Super Overdrive...Sweet Baby is well on the way of living up to that legend as well. I have nothing but high praise for this amazing pedal. It really does react to your playing style. Unlike other overdrive pedals I've used this one really gets smooth when you back off of your string attack and starts to growl the harder you dig in. As far as the pedal goes it is pretty much the same as a lot of them...instead of a tone knob they call it ""focus"", there is also a volume and drive knob. The sounds I can get out of the Sweet Baby are some of the best I've ever used and easy to dial in. I own a lot of pedals but lately I keep my chain setup real simple...the guitar goes into a EHX-Crying Tone wah pedal, then the Sweet Baby, then a Boss Super Overdrive (used as a lead solo gain boost... I don't use Distortion pedals.), next is an MXR Micro Chorus followed by an MXR Carbon Copy Analog Delay. The whole chain goes into the 2nd channel of my Fender Deluxe Reverb amp. I use the foot switch that came with amp to turn on the tremolo when needed... I play mostly Blues and Classic Rock. The Sweet Baby is well made and I don't see it failing me anytime soon. You can spend hundreds more on name brand pedals but what works for me at the end of the day is alive and well in this ""clone"" overdrive tone blender...Update: this pedal has since been returned. It went out with me on a few gigs and didn't hold up to life on the road. The connections inside the box came loose and became a major problem before a few gigs...I have since put my Boss Super Overdrive back in the chain...while I truly loved the tone from this product in the end you get what you pay for.",2.0,And a Sweet Baby it is...until it died at the gig...,0.143161835509605,1.284190822451975
20,Josh Koterba,"[9, 12]","Holy buckets of tone batman!Let me start by saying, I'm always on the quest for great amazing tone. I think it ends here. This pedal is absolutely remarkable. Built like a tank, I'm pretty sure it will out live me. Its full of sonic options.The overdrive has a level, tone and overdrive. Almost self explanatory except the tone is more of a presence knob and less of an EQ which is a total plus in my book. it also has a mini toggle for comp cut, fm, and vintage modes. The comp cut is more of a clean boost to push your amps front end, the fm is really transparent, and the vintage mode gets you that creamy midrange bite.Yes, this may be another tube screamer clone, but it's a darn great one.The added MOSFET circuitry toggle gives it a lovely growl your low-end fattening it up, if thats your cup of tea, while the standard leaves it more transparent. You should know this switch does effect the whole signal, not just that of the boost side.On to my only negative check on this pedal, the boost ONLY works when the OD is on. It is not a boost to be run in series with the overdrive, just additional circuitry to add more gain to your OD signal.Another great feature, this pedal can be run at different volts from 9v-18v.Running at standard 9v gets you easier breakup, whereas 18v will get you more headroom.This pedal won't be leaving my board, probably ever. If you're even thinking about it, just do it!!! You'll never regret it.",5.0,I'll own this pedal for years to come,0.14148979026495068,4.2925510486752465
21,"Amazon Customer ""j allen""","[9, 11]","If you can't find a container and add your own sponge, then buy this.Keeping a valuable guitar humidified is essential.I think this item should cost three bucks at most, and $1.50 would still yield a healthy profit!I made some more from stuff from the dollar which I think are better.I use this one for my baritone uke, and the bigger ones I made I use in my dreadnaughts.If you make your own, just make sure to not let the sponge drip, ie, wring it out, and make sure it does not actually touch any bare wood.",3.0,Better than nothing,0.14037785958614246,2.2981107020692875
22,Clare Chu,"[9, 11]","This compact humidifier is easily filled with an included plastic syringe.  If you don't over-fill, it will not drip, and you can simply place it in your case instead of the usual sponge.",5.0,"Very Easy to Use, Non-Messy",0.13939954363852633,4.303002281807368
23,"Daryl J. Healey ""Daryl""","[9, 11]","This is a sweet ukulele and it looks just as sweet as it sounds! Change the strings immediately, and you have yourself an excellent sounding instrument.  Amplify it with a touch of chorus and feel it too!Only drawback - there is no volume control on the instrument itself.The amp cable that is included is nothing to write home about, and the gig back is a cheap nylon deal - BUT, it's all about the instrument, and I give that a 5.",5.0,Epiphone Les Paul Ukulele,0.13893404821011204,4.30532975894944
24,"Steven K. Baker ""KellRazor""","[9, 10]","UPDATED 3/16/2014After owning the 2i2 for over a year and encountering many difficulties I am revising my once gleaming review.The 2i2 is a simple set-up. Pretty much run your monitors into the line outputs, connect a mic or (apparently) a ""low-headroom"" instrument to it, run the USB cable to your computer and set it up within the DAW described parameters. It would have been nice to know that the included Plug In Suite is not a stand-alone program, and that it functions in tandem with Ableton Live Lite and that it could be found it in the Plug-Ins section of Ableton, but I figured it out EVENTUALLY regardless. (Ableton itself is rather dodgy, and seems to crash constantly.) Sometimes the 2i2 seems to lock up completely, so as no audio is being produced from my monitors!I wasn't sure for a very long time if this was USER ERROR, an Ableton problem, or the fault of the 2i2 and its drivers, so after the gazillionth crash, I screamed ""Ballsdogit!!!"", and purchased a license for Reaper. After going through the painstaking setup and acclimating to the new DAW over the last few months, I began to realize that my monitors no longer ""lock up"", but that the drivers for the 2i2 are indescribably pathetic!!!I had to tweak the living daylights out of Reaper just to get an audible sound out of my monitors. Now I'm in there and the FX do not work with the focusrite drivers. Garbage focusrite! Everyone I know that has Reaper raves about the plug-ins, and the greatness and ease of the setup regardless of the interface. I have yet to experience a crash, but I also have yet to experience any recording time.Seriously, I started reading on the Reaper Forums about problems encountered with the 2i2, and came across a response from David@focusrite actually saying that ""you should not use this setup to record electric guitar.."", and that if you need to record electric guitar you should ""get something with more headroom like the 2i4."" That is just unbelievable in my eyes!I'm sure I could run this through my mixer and get the lacking headroom and just use this paperweight as a bridge gap between my mixer and laptop, but why should I have to after dropping a buck fifty on this miracle? Besides that, I'll more than likely still have multiple problems with the drivers!This device is clearly marked for both XLR inputs and 1/4 instrument ins. There was no warning of headroom limitations anywhere in the documentation, and I researched audio interfaces for several weeks before deciding on this unit. I feel lied to and disrespected as a customer, now stuck with an irrelevant piece of outdated technology. HOW IN THE HECK DOES THIS THING HAVE A NEARLY 5 STAR RATING!!!????The good side is that the mic pres are nice and warm. I have a bunch of different mics and the 2i2 (when not crashing or locking up the monitors) seems to handle all of them well. I constantly check for driver updates, and have the latest drivers for the 2i2, but without a doubt the Focusrite Scarlett 2i2 is probably going by the wayside along with my faith in focusrite and their products.Sorry focusrite, you dropped the ball here.",1.0,No Headroom for Electric Guitar,0.13823279705827043,0.30883601470864785
25,"TomVette ""TomVette""","[9, 10]","I recently purchased this recorder and have compared it to my older M-Audio Microtrak II. The Tascam is a much newer design and shows good ergonomic improvement. The internal mics are adjustable, the interface is easy to use, the battery life is long and the batteries are common AA and easy to replace on location.I've not tested the external xlr mic preamps but have recorded with the internal mics with absolutely wonder results. The internal preamp is very quiet, the mics on acoustic grand piano are very dynamic, produce excellent detail and have what appears to be a very wide neutral frequency response. The recorder produces a very wide and deep soundstage and does outclass my older recorder in every aspect. To me the price is very reasonable and the build quality is reasonable for the price. Highly recommended.",5.0,Excellent recorder,0.1376735240889725,4.311632379555138
26,Rock Morton,"[9, 10]","Reputedly the Joyo Us Dream is a copy of the Suhr Riot distortion pedal. After watching a side by side comparison on Youtube, I decided to buy one.I would describe the Us Dream as sounding like a bright Proco Rat with a little less sustain and a much tighter low end. It has an MXR style enclosure (that means you have to remove the back plate to change batteries) and a surprisingly narrow sweet spot. But for $48 dollars I'm  happy with purchase.",4.0,"One trick pony, but I really like it.",0.1372082105464283,3.3139589472678583
27,Orcatrino,"[9, 10]","Well, just got it, plugged in and here are some initial impressions.1. Pretty much what I expected - much more ""relaxed"" at higher volumes than the M1.2. Definitely much bigger and fuller sounding with its commensurate drawbacks.- slightly less naturally sparkly compared to the M1- will have to reduce the mids a bit via the Fuse editor.- although it has less overall sparkle, that also translates to smoother highs. I was actually a bit hard pressed to get it to sound buzzy. This is of course via the front panel only. I'm sure it can be done using the Fuse editor.3. It's supposed to be 7 lbs. heavier than the M1 but it sure doesn't feel like it. I keep looking at the M1 fiendishly wondering if there's a way to shoehorn a 12"" speaker in there.4. For the most part, the patches created in the M1 translated pretty well after the required firmware update, needing just a few adjustments here and there.5. I'm appreciative of the fuller more naturally extended low end as I won't have to crank the bass control as much as I have to on the M1. That of course translates to more headroom for the power amp.More from editing via Fuse - here are a few of the things that I found and liked.- The 65 Deluxe model sounds better with the 57 Deluxe's Cab and vice versa. The 65 has more headroom and works great as a clean spanky amp with the 57's cab while the 57 model's propensity to break up sooner works better with the 65's less sparkly cab. The 57 also seems to have more low end girth.- The Twin is a bit too icepick-y sometimes and it seems to pair better with the Bassman's cab.- The SuperSonic's Cab is a bit more muted at the top end than any of the other cabs and works well for sounds I use that have a bit more gain. It's good for keeping things from getting too buzzy. It's a very fat sounding Cab sim.- Both the M1 and 2 seem to respond really well with my Tex-Mex pickups. I have not played a guitar with regular sized humbuckers on these amps yet (my other guitar has mini humbuckers) but somehow I get the feeling that I won't like it as much as I do with the strat. I think this is understandable though. Since Fender has always been all about the single coils, I'm not surprised that the impedance relationship between these amps and my strat feels so spot on.So far, for 200 bucks... I couldn't ask for more.",5.0,Just as I expected.,0.13721193569979986,4.313940321501001
28,Darren,"[9, 10]","I bought this to use primarily with my newly bought Ukulele, but it also works perfectly to tune my old acoustic guitar too. The display is large and clear and the reading is extremely accurate. I wish I'd bought one of these years ago instead of tuning my stringed instruments manually ""by ear"". Until now I'd assumed I tuned my instruments perfectly well, but this unit proved me wrong - both my Uke and guitar sound better after being fine tuned with this.This little gadget saves time, improves tuning accuracy and is absolutely perfect for the job it is designed for.It comes supplied with a CR2032 battery and a basic protective bag to keep it in when not in use.",5.0,A product that becomes indispensable from the first time you use it.,0.13748632210250508,4.312568389487475
29,kwb,"[9, 10]","When you need a no-nonsense leather strap that is not long, consider this. If you need something fancy, or want to sling your guitar low, or if you are a tall person, probably you want to skip this.I'm 5ft 8"" and I'm already using the longest setting with my acoustic that has a strap button on the heel of the neck as well as the end pin, and it's not like I'm trying to hold my guitar particularly low. If you are a tall person, or if you want to mimic Jimmy Page's posture or something, this is not for you.Apart from that, I have to say that the cost performance of this thing is really impressive (it's more so if I believe the ""made in Canada"" sticker on it). Hard to beat it as far as leather straps go. At 2.5 inches wide, it's comfortable, one-ply leather is reasonably pliable yet seems to be thick enough, and the looks of it is not that bad either. Sure, there should be nicer/better product, but you cannot buy them for 12 bucks.The only complaint I have is that a sticker that left some sticky residue was on the back side of the strap. Though it was not a big deal to remove the residue using rubbing alcohol and some  elbow grease, it would have been nice if I was able to use it without any extra work without worrying about some gummy sticky thing rubbed on the guitar.",4.0,Very good cost/performance ratio as far as leather straps go,0.13765539647763875,3.311723017611806
30,Christian Matthew,"[9, 10]","The previous reviewer obviously got a defective case. The case I got works incredibly well, and always keeps the guitar well protected, and my back comfortable while carrying it. It has a lot of space, and it looks pretty good too. I'd recommend it to anyone!EDIT* I've had 3 good years with this bag, and it has still yet to rip on me.",5.0,Works really well!!,0.13799307093673338,4.310034645316333
31,MrGizmo,"[9, 10]","Depending on the amp and guitar you have, this pedal is going to either really be great or be a bummer. It sounds terrific with my fender strat (single coil) Danelectro (lipstick pickups) on my solid state amps, giving them a warm tube like overdrive.It sounds terrible on my tube amp and my vintage silvertone amp, it really sounds aweful with my 1980's Kramer, loaded with humbucker pickups.You'll either love it or hate it! That will decide mostly on the type of guitar and amp you use, it's a different pedal with every combination.",4.0,On some amps it smokes and other amps it fizzles,0.13823042253182788,3.3088478873408604
32,"Mike Tarrani ""Jazz Drummer""","[9, 10]","I purchased this when it was on sale during the Christmas season - I figured that for the asking price at the time I could not go wrong.My expectations were frankly low. I had heard nothing but horrible things about Epiphones, with the main complaint being they would not stay in tune. Other complaints included poor overall quality and terrible playability. What I received was the polar opposite: I received an instrument with a strikingly beautiful finish, and one that stays in tune (amazingly it was close to being in perfect tune when I unboxed it.)I am not wild about the strings that came stock, but I am a drummer and suffer the same disappointment about heads that ship with new drums. I guess guitarists expect to change strings on a new guitar the same way drummers do when it comes to heads. In the near future I intend to restring the guitar withD'Addario ECG25 Chromes Flat Wound Electric Guitar Strings, Light, 12-52, which, while thick, should make the instrument jazz-friendly. I realize that flatwound strings will require a new set-up and intonation, but considering how good the guitar is and how relatively little it cost me, the new strings and work will be an investment.Out of the box, though, the action was reasonably low and the frets appeared [to my novice eyes and fingers] to be properly dressed. I have already invested in a good - but not great case:Guardian Hardshell Electric Guitar Caseto store the guitar (I also uploaded a customer-provided photo on this page that shows the case and how well the guitar fits.)For the record, I use the following amp, which I have also reviewed that is a perfect match to this guitar:Kustom Defender 15 Watt Class A Guitar Headthat I run through aKustom  The Defender 1 x 12 Guitar Extension Cabinet for 5H Head.Bottom line: this is a great instrument for beginners and not a bad one for experienced players. The price is right, and the quality clearly shows that off shore manufacturers have made significant improvements over the past year.",5.0,Five stars for value and playability,0.13827707473907547,4.308614626304623
33,"Amazon Customer ""remo""","[9, 10]",I bought this pick holder because I hate putting a pick between my strings to hold it and because you can't play with a pick in your strings. I originally thought this thing would be kind of large and go all the way across the headstock. Boy was I wrong. The picture is misleading.  This thing is tiny and barely goes across three string. It wedges under neath two strings and you can put two picks (maybe more if they are thin) into the wedges on top. Stays in place well and is very convenient.Only negative is I don't know how long it will hold up. I think maybe a thicker rubber rather than this foam rubber would have held up better. I can see this thing eventually losing tension in the pick holder wedges and dropping picks.,4.0,Nice little pick holder,0.1381093400301806,3.309453299849097
34,"Rob W. ""Sounddude""","[9, 10]","Considering that the SM57 was introduced to the world in 1967, a year after the Shure SM58LC Shure SM58 Vocal Microphone, I guess the 58 gets Batman status, relegating the 57 to that of Robin. But that's not really a fair assessment considering the 57 and 58 were developed at the same time, and except for the 58's acoustic foam lined cage pop screen, the two mics are identical electrically.The SM (Studio Microphone) 57 was designed to begin it's life in a recording studio, as a dynamic microphone used to mic the ever increasing volume of rock and roll amplifiers, drum kits, etc. In that capacity, it had no use for the pop screen of it's cousin the SM58, still one of the most sold vocal mics in the world to this day. So the SM57 slimmed down and even though it's still a fine vocal mic, you'll see it used mostly mic'ing instruments, which it excels at.One of it's long time and most important roles has been the official podium mic for the White House. A pair of SM57's is always seen on various White House podiums for press conferences and there is even a VIP bundled kitShure SM57 VIP Dual Microphone Kityou can buy for this exact type of use.The SM57 is an extremely rugged mic, built to tough standards and can take lots of road abuse. That's one of the things that makes it popular with touring bands and sound companies. And on top of that, it's just a great sounding mic for the price.There is a Performer SeriesShure Beta 57A Microphonethat looks very similar to the SM57 but the Beta 57 has a different mic capsule and transformer and sounds different. So make sure you try before you buy.Bottom line is the Shure SM57 is one tough road mic that sounds awesome and is not overly priced. A best value for sound companies, home studio recordists and touring musicians.",4.0,One Half Of Shure's Long Lasting Dynamic Duo,0.13820278164178107,3.3089860917910947
35,Daniel G. Lebryk,"[9, 10]","These acoustic strings are used on a Laguna acoustic guitar. They are just the right weight, and just the right amount of flex. We've tried D'Addario, brighter sound (D'Addario Acoustic Guitar Strings Set, EXP 80/20 Lite), and Martin, a little stiff (Martin Strings SP Phosphor Bronze 12.5-55 MSP4150). In the end, these Elixirs sound and feel best on this guitar.As has been said, there is no perfect guitar string for everyone. The perfect guitar string is the one that feels and sounds right to you on your guitar. For the combination we have, these are outstanding strings.On the strings lasting longer, that's hard to say. Fresh strings do sound better. It's clear that the wound strings do not corrode like non-coated strings. But I'm not certain these last so much longer. We buy them because they sound good and have the right amount of flex to them - playability. Corrosion or crud on the string isn't the sole factor in changing strings.June 15, 2010 Update: Elixir is a wonderful company. On my third or fourth sets of Elixir strings, the G string snapped as my son was tuning the guitar for the first time. Elixir is outstanding, they will replace any string that doesn't perform up to your standard.The other amazing thing - I've watched tons of videos and watched a lot of guys change strings, and I'm still very confused. The Elixir website (it's pretty simple elixirstring dot com) is outstanding. Ther is a two part video from the Taylor factory on how to change strings. I swear that if you follow those instructions, you will change strings in minutes. It is so simple and so reproducible. I love this technique.I'm a huge fan of these strings now!",5.0,Elixir's Have Become Our Standard,0.13874343685928187,4.30628281570359
36,Nathan A. Edwards,"[88, 89]","This instrument might actually be in a class of its own. That is, it would be extremely difficult to find a guitar in this price band that comes even remotely close in terms of quality; not only with regard to craftsmanship, but certainly the sound it produces. The Applause exceeds expectation whether it is unplugged, amplified, or even run directly through a mixer. Beyond sounding comparatively spectacular, it is far more durable than perhaps any other hollow-bodied instrument on the market due to its components and design. The electronics are reliable and the instrument is accessible, or playable, to even the most novice of musicians. This guitar is the ideal instrument for a beginner or a younger musician, simply because it is cost efficient, durable, and as easy to play for the price as one might be able to find anywhere. Even experienced guitarists will almost certainly appreciate its action, sound and durability if not only for the purposes of practice and travel. This is an exceptional value and an excellent instrument.",5.0,An Unbeatable Value,0.13951536215659202,4.3024231892170395
